{
  "description": "Categoria: Ciencia de datos, IoT & microcontroladores\n\nSe explican las nociones del funcionamiento de nanosat\u00e9lites, el rol que Python cumple durante su desarrollo, y c\u00f3mo esto se aplic\u00f3 para desarrollar el nanosat\u00e9lite tipo cansat m\u00e1s avanzado en Chile\nContenido:\n- Problemas del desarrollo cient\u00edfico en Chile\n- Breve Introducci\u00f3n a los Nanosat\u00e9lites\n- Python: Programando un nanosat\u00e9lite\n- Python: Ejemplos de Dashboards\n- El origen de Octa Aerospace\n- Educaci\u00f3n satelital\n- Los efectos de la comunicaci\u00f3n en equipo\n\nRecursos:\nOcta Aerospace:\n  LinkedIn: https://www.linkedin.com/company/octa-aerospace/\n  P\u00e1gina: https://www.octaaerospace.com/\n  GitHub: https://github.com/Octa-Aerospace\n  Instagram: https://www.instagram.com/octaaerospace/\n\nRepositorio hardware:\nhttps://github.com/Rodrigo-Flores/SIMESAT-CanSat-V2\n\nRepositorio dashboard:\nhttps://github.com/CxrlosKenobi/Dashboard-SIMESAT-1\n\nPresentaci\u00f3n:\nhttps://drive.google.com/file/d/1yrVfXaeehUqQpSnrHKw2WR2RRaf85J40/view?usp=sharing \r\n\nContacto:\nhttps://linkedin.com/in/carloskenobi\nhttps://linkedin.com/in/rodrigo-flores-1207\n\n-------------------------------------------------------------------------------------------------------------------------------------------------------\n\nPyCon Chile 2021 - https://pycon.cl/\n\nPyCon Chile es un evento gratuito organizado por la comunidad Python Chile, para promover la divulgaci\u00f3n y ense\u00f1anza de Python. Esta conferencia busca reunir a todos los entusiastas de Python, desde principiantes hasta usuarios avanzados, para compartir distintas tem\u00e1ticas relacionadas al lenguaje.\n\nSi te interesa utilizar Python en \u00e1reas tan variadas como ciencia de datos, inteligencia artificial, astronom\u00eda, geolog\u00eda, optimizaci\u00f3n matem\u00e1tica o ciencias sociales, entre otras, \u00a1este evento te encantar\u00e1!\n\n\u2605 \u00a1\u00danete a la comunidad! \u2605\n\n\u2022 Twitter: https://twitter.com/pythonchiledev\n\u2022 Facebook: https://www.facebook.com/groups/pytho...\n\u2022 Telegram: https://t.me/pythonchile\n\u2022 Discord: https://discord.gg/dTHMfJvauS",
  "duration": 1806,
  "language": "spa",
  "recorded": "2021-11-07",
  "related_urls": [
    {
      "label": "Conference Website",
      "url": "https://pycon.cl/2021/"
    },
    {
      "label": "https://www.instagram.com/octaaerospace/",
      "url": "https://www.instagram.com/octaaerospace/"
    },
    {
      "label": "https://drive.google.com/file/d/1yrVfXaeehUqQpSnrHKw2WR2RRaf85J40/view?usp=sharing",
      "url": "https://drive.google.com/file/d/1yrVfXaeehUqQpSnrHKw2WR2RRaf85J40/view?usp=sharing"
    },
    {
      "label": "https://github.com/CxrlosKenobi/Dashboard-SIMESAT-1",
      "url": "https://github.com/CxrlosKenobi/Dashboard-SIMESAT-1"
    },
    {
      "label": "https://twitter.com/pythonchiledev",
      "url": "https://twitter.com/pythonchiledev"
    },
    {
      "label": "https://www.octaaerospace.com/",
      "url": "https://www.octaaerospace.com/"
    },
    {
      "label": "https://www.facebook.com/groups/pytho...",
      "url": "https://www.facebook.com/groups/pytho..."
    },
    {
      "label": "https://github.com/Octa-Aerospace",
      "url": "https://github.com/Octa-Aerospace"
    },
    {
      "label": "https://linkedin.com/in/carloskenobi",
      "url": "https://linkedin.com/in/carloskenobi"
    },
    {
      "label": "https://linkedin.com/in/rodrigo-flores-1207",
      "url": "https://linkedin.com/in/rodrigo-flores-1207"
    },
    {
      "label": "https://pycon.cl/",
      "url": "https://pycon.cl/"
    },
    {
      "label": "https://www.linkedin.com/company/octa-aerospace/",
      "url": "https://www.linkedin.com/company/octa-aerospace/"
    },
    {
      "label": "https://t.me/pythonchile",
      "url": "https://t.me/pythonchile"
    },
    {
      "label": "https://github.com/Rodrigo-Flores/SIMESAT-CanSat-V2",
      "url": "https://github.com/Rodrigo-Flores/SIMESAT-CanSat-V2"
    },
    {
      "label": "https://discord.gg/dTHMfJvauS",
      "url": "https://discord.gg/dTHMfJvauS"
    }
  ],
  "speakers": [
    "TODO"
  ],
  "tags": [
    "Ciencia de datos",
    "Iot & microcontroladores"
  ],
  "thumbnail_url": "https://i.ytimg.com/vi/d03XNYkD5sE/maxresdefault.jpg",
  "title": "Aplicando Python al desarrollo de nanosat\u00e9lites - Rodrigo Flores y Carlos Pinto",
  "videos": [
    {
      "type": "youtube",
      "url": "https://www.youtube.com/watch?v=d03XNYkD5sE"
    }
  ]
}
