{
  "description": "Categoria: Testing, Buenas pr\u00e1cticas\n\nPython cuenta con una serie de buenas pr\u00e1cticas que permiten convertir un script de \"pica teclas\" vuelto un \"spaghetti\" a una pieza digna del Zen de Python. Algunas de las mencionadas en la charla son: formato del c\u00f3digo y herramientas para formateo \u00e1gil; qu\u00e9 es un \"code smell\", c\u00f3mo identificarlo y no confundirlo; y por \u00faltimo c\u00f3mo escribir c\u00f3digo pythonico\n\nRecursos:\nPresentaci\u00f3n:\nhttps://docs.google.com/presentation/d/1eVBthcjRd-rXsCTYfFDOl-qBnWiHEsDtHw4SGXbNsvk/edit#slide=id.p \r\n\nContacto:\n\u2022 https://twitter.com/terranigmark\n\u2022 https://linkedin.com/in/terranigma\n\n-----------------------------------------------------------------------------------------------------------------------------------------------------------\n\nPyCon Chile 2021 - https://pycon.cl/\n\nPyCon Chile es un evento gratuito organizado por la comunidad Python Chile, para promover la divulgaci\u00f3n y ense\u00f1anza de Python. Esta conferencia busca reunir a todos los entusiastas de Python, desde principiantes hasta usuarios avanzados, para compartir distintas tem\u00e1ticas relacionadas al lenguaje.\n\nSi te interesa utilizar Python en \u00e1reas tan variadas como ciencia de datos, inteligencia artificial, astronom\u00eda, geolog\u00eda, optimizaci\u00f3n matem\u00e1tica o ciencias sociales, entre otras, \u00a1este evento te encantar\u00e1!\n\n\u2605 \u00a1\u00danete a la comunidad! \u2605\n\n\u2022 Twitter: https://twitter.com/pythonchiledev\n\u2022 Facebook: https://www.facebook.com/groups/pytho...\n\u2022 Telegram: https://t.me/pythonchile\n\u2022 Discord: https://discord.gg/dTHMfJvauS",
  "duration": 1759,
  "language": "spa",
  "recorded": "2021-11-07",
  "related_urls": [
    {
      "label": "Conference Website",
      "url": "https://pycon.cl/2021/"
    },
    {
      "label": "https://twitter.com/pythonchiledev",
      "url": "https://twitter.com/pythonchiledev"
    },
    {
      "label": "https://linkedin.com/in/terranigma",
      "url": "https://linkedin.com/in/terranigma"
    },
    {
      "label": "https://docs.google.com/presentation/d/1eVBthcjRd-rXsCTYfFDOl-qBnWiHEsDtHw4SGXbNsvk/edit#slide=id.p",
      "url": "https://docs.google.com/presentation/d/1eVBthcjRd-rXsCTYfFDOl-qBnWiHEsDtHw4SGXbNsvk/edit#slide=id.p"
    },
    {
      "label": "https://www.facebook.com/groups/pytho...",
      "url": "https://www.facebook.com/groups/pytho..."
    },
    {
      "label": "https://twitter.com/terranigmark",
      "url": "https://twitter.com/terranigmark"
    },
    {
      "label": "https://pycon.cl/",
      "url": "https://pycon.cl/"
    },
    {
      "label": "https://t.me/pythonchile",
      "url": "https://t.me/pythonchile"
    },
    {
      "label": "https://discord.gg/dTHMfJvauS",
      "url": "https://discord.gg/dTHMfJvauS"
    }
  ],
  "speakers": [
    "TODO"
  ],
  "tags": [
    "Buenas pr\u00e1cticas",
    "pycon chile",
    "python chile"
  ],
  "thumbnail_url": "https://i.ytimg.com/vi/_-2erPEYbjk/maxresdefault.jpg",
  "title": "Buenas pr\u00e1cticas para dejar de ser junior en Python - Hector Vega",
  "videos": [
    {
      "type": "youtube",
      "url": "https://www.youtube.com/watch?v=_-2erPEYbjk"
    }
  ]
}
