{
  "description": "Categoria: Ciencia de datos, Computaci\u00f3n Cient\u00edfica, Astronom\u00eda\n\nPodr\u00e1s aprender una aplicaci\u00f3n de ML y Python a datos astron\u00f3micos que son de acceso p\u00fablico.\nSiguiendo los descubrimientos de c\u00famulos abiertos con poblaciones de estrellas masivas\nen el lado cercano de la barra Gal\u00e1ctica, este trabajo tiene por objetivo buscar este tipo de\nc\u00famulos en el lado lejano de la barra. Para ello, hemos desarrollado un algoritmo basado\nen t\u00e9cnicas de aprendizaje de m\u00e1quinas no supervisado, llamado Apolo, el cual permite la\nidentificaci\u00f3n de sobredensidades en el espacio de par\u00e1metros compuesto por posiciones en el cielo, movimientos propios y fotometr\u00eda en el infrarrojo cercano usando datos de VVV,\n2MASS y Gaia.\n\nRecursos:\nhttps://github.com/adamdempsey90/StarClusters\nhttps://github.com/jorgeanais/apolo\nPresentaci\u00f3n: https://drive.google.com/file/d/1LyNOVVWYNNLY08txkigK_gEfIQU60HZV/view?usp=sharing\nTesis con todos los detalles de la investigaci\u00f3n: https://drive.google.com/file/d/1jOm1EbwCMeIM_4Pfu6WMQxPkQsNnG443/view?usp=sharing\"\n\nContacto:\nhttps://linkedin.com/in/jorge-anais-vilchez-3b9263a0\n\n-------------------------------------------------------------------------------------------------------------------------------------------------------\n\nPyCon Chile 2021 - https://pycon.cl/\n\nPyCon Chile es un evento gratuito organizado por la comunidad Python Chile, para promover la divulgaci\u00f3n y ense\u00f1anza de Python. Esta conferencia busca reunir a todos los entusiastas de Python, desde principiantes hasta usuarios avanzados, para compartir distintas tem\u00e1ticas relacionadas al lenguaje.\n\nSi te interesa utilizar Python en \u00e1reas tan variadas como ciencia de datos, inteligencia artificial, astronom\u00eda, geolog\u00eda, optimizaci\u00f3n matem\u00e1tica o ciencias sociales, entre otras, \u00a1este evento te encantar\u00e1!\n\n\u2605 \u00a1\u00danete a la comunidad! \u2605\n\n\u2022 Twitter: https://twitter.com/pythonchiledev\n\u2022 Facebook: https://www.facebook.com/groups/pytho...\n\u2022 Telegram: https://t.me/pythonchile\n\u2022 Discord: https://discord.gg/dTHMfJvauS",
  "duration": 1733,
  "language": "spa",
  "recorded": "2021-11-07",
  "related_urls": [
    {
      "label": "Conference Website",
      "url": "https://pycon.cl/2021/"
    },
    {
      "label": "https://drive.google.com/file/d/1LyNOVVWYNNLY08txkigK_gEfIQU60HZV/view?usp=sharing",
      "url": "https://drive.google.com/file/d/1LyNOVVWYNNLY08txkigK_gEfIQU60HZV/view?usp=sharing"
    },
    {
      "label": "https://github.com/adamdempsey90/StarClusters",
      "url": "https://github.com/adamdempsey90/StarClusters"
    },
    {
      "label": "https://twitter.com/pythonchiledev",
      "url": "https://twitter.com/pythonchiledev"
    },
    {
      "label": "https://www.facebook.com/groups/pytho...",
      "url": "https://www.facebook.com/groups/pytho..."
    },
    {
      "label": "https://linkedin.com/in/jorge-anais-vilchez-3b9263a0",
      "url": "https://linkedin.com/in/jorge-anais-vilchez-3b9263a0"
    },
    {
      "label": "https://pycon.cl/",
      "url": "https://pycon.cl/"
    },
    {
      "label": "https://github.com/jorgeanais/apolo",
      "url": "https://github.com/jorgeanais/apolo"
    },
    {
      "label": "https://drive.google.com/file/d/1jOm1EbwCMeIM_4Pfu6WMQxPkQsNnG443/view?usp=sharing",
      "url": "https://drive.google.com/file/d/1jOm1EbwCMeIM_4Pfu6WMQxPkQsNnG443/view?usp=sharing"
    },
    {
      "label": "https://t.me/pythonchile",
      "url": "https://t.me/pythonchile"
    },
    {
      "label": "https://discord.gg/dTHMfJvauS",
      "url": "https://discord.gg/dTHMfJvauS"
    }
  ],
  "speakers": [
    "TODO"
  ],
  "tags": [
    "Astronom\u00eda",
    "Ciencia de datos",
    "Computaci\u00f3n Cient\u00edfica",
    "pycon chile",
    "python chile"
  ],
  "thumbnail_url": "https://i.ytimg.com/vi/XtSLA3wwaBk/maxresdefault.jpg",
  "title": "B\u00fasqueda de c\u00famulos estelares usando aprendizaje de m\u00e1quina no supervisado - Jorge Anais Vilchez",
  "videos": [
    {
      "type": "youtube",
      "url": "https://www.youtube.com/watch?v=XtSLA3wwaBk"
    }
  ]
}
