{
  "description": "Categor\u00eda: Ciencia de datos, Visi\u00f3n por Computador, Procesamiento Lenguage Natural\n\n\u00bfC\u00f3mo puedes mostrar lo que hace un modelo de Machine Learning una vez que est\u00e1 entrenado? En esta charla, Omar ense\u00f1ar\u00e1 c\u00f3mo crear aplicaciones y demos de Machine Learning utilizando Streamlit y Gradio, bibliotecas de Python enfocadas a este prop\u00f3sito. Adicionalmente, Omar mostrar\u00e1 c\u00f3mo compartirlos con el resto del ecosistema Open Source.\n\nRecursos:\n\u2022 http://hf.co/spaces\n\u2022 https://hf.co/spaces/launch\n\u2022 https://hf.co/join/discord\n\n\u2022 https://huggingface.co/spaces/flax-community/dalle-mini\n\u2022 https://huggingface.co/spaces/flax-community/chef-transformer\n\u2022 https://huggingface.co/spaces/nielsr/LayoutLMv2-FUNSD\n\u2022 https://github.com/TheHackerLlama/charlas/blob/main/gradio_demos.ipynb\n\n\u2022 http://hf.co/models tiene 20000 modelos Open Source compartidos por la comunidad. Casi 400 en espanol, pero podemos tener muchos mas!\n\n\u2022 slides: https://www.canva.com/design/DAEu5fZ_wTY/Ra_T_nb4K9AJz6rz0hb43Q/view\"\n\nContacto:\n\u2022 https://twitter.com/osanseviero\n\u2022 https://linkedin.com/in/omarsanseviero\n\n----------------------------------------------------------------------------------------------------------------------------------------------------\n\nPyCon Chile 2021 - https://pycon.cl/\n\nPyCon Chile es un evento gratuito organizado por la comunidad Python Chile, para promover la divulgaci\u00f3n y ense\u00f1anza de Python. Esta conferencia busca reunir a todos los entusiastas de Python, desde principiantes hasta usuarios avanzados, para compartir distintas tem\u00e1ticas relacionadas al lenguaje.\n\nSi te interesa utilizar Python en \u00e1reas tan variadas como ciencia de datos, inteligencia artificial, astronom\u00eda, geolog\u00eda, optimizaci\u00f3n matem\u00e1tica o ciencias sociales, entre otras, \u00a1este evento te encantar\u00e1!\n\n\u2605 \u00a1\u00danete a la comunidad! \u2605\n\n\u2022 Twitter: https://twitter.com/pythonchiledev\n\u2022 Facebook: https://www.facebook.com/groups/pytho...\n\u2022 Telegram: https://t.me/pythonchile\n\u2022 Discord: https://discord.gg/dTHMfJvauS",
  "duration": 1493,
  "language": "spa",
  "recorded": "2021-11-07",
  "related_urls": [
    {
      "label": "Conference Website",
      "url": "https://pycon.cl/2021/"
    },
    {
      "label": "https://huggingface.co/spaces/flax-community/chef-transformer",
      "url": "https://huggingface.co/spaces/flax-community/chef-transformer"
    },
    {
      "label": "http://hf.co/spaces",
      "url": "http://hf.co/spaces"
    },
    {
      "label": "https://huggingface.co/spaces/flax-community/dalle-mini",
      "url": "https://huggingface.co/spaces/flax-community/dalle-mini"
    },
    {
      "label": "https://www.canva.com/design/DAEu5fZ_wTY/Ra_T_nb4K9AJz6rz0hb43Q/view",
      "url": "https://www.canva.com/design/DAEu5fZ_wTY/Ra_T_nb4K9AJz6rz0hb43Q/view"
    },
    {
      "label": "https://twitter.com/pythonchiledev",
      "url": "https://twitter.com/pythonchiledev"
    },
    {
      "label": "https://hf.co/join/discord",
      "url": "https://hf.co/join/discord"
    },
    {
      "label": "https://linkedin.com/in/omarsanseviero",
      "url": "https://linkedin.com/in/omarsanseviero"
    },
    {
      "label": "https://www.facebook.com/groups/pytho...",
      "url": "https://www.facebook.com/groups/pytho..."
    },
    {
      "label": "https://huggingface.co/spaces/nielsr/LayoutLMv2-FUNSD",
      "url": "https://huggingface.co/spaces/nielsr/LayoutLMv2-FUNSD"
    },
    {
      "label": "https://discord.gg/dTHMfJvauS",
      "url": "https://discord.gg/dTHMfJvauS"
    },
    {
      "label": "https://pycon.cl/",
      "url": "https://pycon.cl/"
    },
    {
      "label": "https://twitter.com/osanseviero",
      "url": "https://twitter.com/osanseviero"
    },
    {
      "label": "https://github.com/TheHackerLlama/charlas/blob/main/gradio_demos.ipynb",
      "url": "https://github.com/TheHackerLlama/charlas/blob/main/gradio_demos.ipynb"
    },
    {
      "label": "http://hf.co/models",
      "url": "http://hf.co/models"
    },
    {
      "label": "https://t.me/pythonchile",
      "url": "https://t.me/pythonchile"
    },
    {
      "label": "https://hf.co/spaces/launch",
      "url": "https://hf.co/spaces/launch"
    }
  ],
  "speakers": [
    "TODO"
  ],
  "tags": [
    "Ciencia de datos",
    "Procesamiento Lenguage Natural",
    "Visi\u00f3n por Computador",
    "pycon chile",
    "python chile"
  ],
  "thumbnail_url": "https://i.ytimg.com/vi/Mg7YeWBUKbM/maxresdefault.jpg",
  "title": "C\u00f3mo construir demos de Machine Learning con Python - Omar Sanseviero",
  "videos": [
    {
      "type": "youtube",
      "url": "https://www.youtube.com/watch?v=Mg7YeWBUKbM"
    }
  ]
}
