{
  "description": "Angel Galicia\n\n\nWisphub\n\n\nSocial Networks:\n\nTwitter: https://twitter.com/miknotauro\nGitHub: https://github.com/MIKNOTAURO\n\n\nProcesamiento de datos en sistemas distribuidos con python (Español)\n\n\nAntecedentes Hoy en dia es muy común escuchar que python se usa en el análisis de datos, lo cual es cierto, lo que casi nunca nos detenemos a pensar es ¿De donde vienen esos datos?, ¿Cómo se generaron?, ¿Cómo se guardan?, ¿Cómo se actualizan y con qué frecuencia?, etc. En esta charla explicaré estos puntos y nos enfocaremos en un caso muy específico (Real\nTime Data Sources) que cada vez más han ido adoptando diferentes industrias en la era de la información .\n\nIntrducción \n 5 min Hablo acerca de cómo surgió la necesidad de implementar una solución custom y los problemas de los productos del mercado\n\nPanorama general \n 5 min Explicación de los componentes principales de la arquitectura del sistema.\n\nProcesamiento de datos \n 15 min Es la parte principal de la charla y mostraré como podemos utilizar python (con ayuda de la biblioteca de Faust) para sistemas críticos que requieren procesamiento a gran velocidad de grandes volúmenes de información, desmintiendo el mito de que python es muy lento para usarlo en este tipo de sistemas.\n\nConclusiones \n 5 min Benchmarks realizados y consideraciones.\n\n\nWe want to say thanks to all our sponsors who helped make the conference a huge success.\n\n\n Universidad EAFIT \n http://www.eafit.edu.co/\n\n Globant \n https://www.globant.com/\n\n Linode \n https://www.linode.com/\n\n Mercadolibre.com \n https://www.mercadolibre.com.co/\n\n monoku.com \n https://monoku.com/\n\n Playvox \n https://www.playvox.com/\n\n UruIT \n https://uruit.com/\n\n Elastic \n https://www.elastic.co/es/\n\n #The_Python_Software_Foundation \n https://www.python.org/\n\n Monadical \n https://monadical.com/\n\n Fluid Attacks \n https://fluidattacks.com/\n\n Swapps \n https://swapps.com/\n\n TributiOnline \n https://www.tributi.com/\n\n VanHack \n https://vanhack.com/\n\n Avanet \n http://avanet.org/\n\n Cafeto Software \n https://cafeto.co/\n\n OmniBnk \n https://omnibnk.com/\n\n AutonomicMind \n https://autonomicmind.com/\n\n #AIFund \n https://aifund.ai/  \n\nFollow us\n\nFacebook: https://www.facebook.com/pyconcolombia\nTwitter: https://twitter.com/pyconcolombia\nInstagram:  https://www.instagram.com/pyconcolombia/\nTelegram: https://t.me/pyconcolombia\nLinkedIn: https://www.linkedin.com/company/pycon\ncolombia/\nFlickr: https://www.flickr.com/photos/pyconcolombia/\n\nMore About PyCon Colombia in http://www.pycon.co",
  "duration": 2390,
  "language": "spa",
  "recorded": "2020\n02\n07",
  "related_urls": [
    {
      "label": "Conference Website",
      "url": "https://2020.pycon.co/"
    },
    {
      "label": "https://cafeto.co/",
      "url": "https://cafeto.co/"
    },
    {
      "label": "https://www.mercadolibre.com.co/",
      "url": "https://www.mercadolibre.com.co/"
    },
    {
      "label": "https://www.linkedin.com/company/pycon\ncolombia/",
      "url": "https://www.linkedin.com/company/pycon\ncolombia/"
    },
    {
      "label": "http://www.eafit.edu.co/",
      "url": "http://www.eafit.edu.co/"
    },
    {
      "label": "https://github.com/MIKNOTAURO",
      "url": "https://github.com/MIKNOTAURO"
    },
    {
      "label": "https://vanhack.com/",
      "url": "https://vanhack.com/"
    },
    {
      "label": "https://swapps.com/",
      "url": "https://swapps.com/"
    },
    {
      "label": "https://www.globant.com/",
      "url": "https://www.globant.com/"
    },
    {
      "label": "https://aifund.ai/",
      "url": "https://aifund.ai/"
    },
    {
      "label": "https://www.facebook.com/pyconcolombia",
      "url": "https://www.facebook.com/pyconcolombia"
    },
    {
      "label": "https://www.elastic.co/es/",
      "url": "https://www.elastic.co/es/"
    },
    {
      "label": "https://t.me/pyconcolombia",
      "url": "https://t.me/pyconcolombia"
    },
    {
      "label": "https://omnibnk.com/",
      "url": "https://omnibnk.com/"
    },
    {
      "label": "https://www.python.org/",
      "url": "https://www.python.org/"
    },
    {
      "label": "https://monadical.com/",
      "url": "https://monadical.com/"
    },
    {
      "label": "https://www.flickr.com/photos/pyconcolombia/",
      "url": "https://www.flickr.com/photos/pyconcolombia/"
    },
    {
      "label": "https://www.playvox.com/",
      "url": "https://www.playvox.com/"
    },
    {
      "label": "http://avanet.org/",
      "url": "http://avanet.org/"
    },
    {
      "label": "https://monoku.com/",
      "url": "https://monoku.com/"
    },
    {
      "label": "https://fluidattacks.com/",
      "url": "https://fluidattacks.com/"
    },
    {
      "label": "https://www.linode.com/",
      "url": "https://www.linode.com/"
    },
    {
      "label": "http://www.pycon.co",
      "url": "http://www.pycon.co"
    },
    {
      "label": "https://twitter.com/pyconcolombia",
      "url": "https://twitter.com/pyconcolombia"
    },
    {
      "label": "https://uruit.com/",
      "url": "https://uruit.com/"
    },
    {
      "label": "https://twitter.com/miknotauro",
      "url": "https://twitter.com/miknotauro"
    },
    {
      "label": "https://www.instagram.com/pyconcolombia/",
      "url": "https://www.instagram.com/pyconcolombia/"
    },
    {
      "label": "https://www.tributi.com/",
      "url": "https://www.tributi.com/"
    },
    {
      "label": "https://autonomicmind.com/",
      "url": "https://autonomicmind.com/"
    }
  ],
  "speakers": [
    "Angel Galicia"
  ],
  "tags": [],
  "thumbnail_url": "https://i.ytimg.com/vi_webp/n7QbZDmXlUo/maxresdefault.webp",
  "title": "Procesamiento de datos en sistemas distribuidos con python",
  "videos": [
    {
      "type": "youtube",
      "url": "https://www.youtube.com/watch?v=n7QbZDmXlUo"
    }
  ]
}
