{
  "description": "Kevin Hern√°ndez\n\n\nwww.apploi.com\n\n\nSocial Networks:\n\nTwitter: https://twitter.com/keeevinh\nGithub: https://github.com/kevteg\nLinkedIn: https://www.linkedin.com/in/keeeevin/\n\n\nY is X but X is not always Y: An introduction to Python internals (Espa√±ol)\n\n\nPython es un lenguaje que tiene caracter√≠sticas muy interesantes y hay ciertos aspectos que parecen magia, sobre todo cuando se trata de su funcionamiento interno. En esta charla hablo sobre las diferencias entre los diferentes int√©rpretes y de como Python emplea el uso de singletons para mejorar la productividad, porque los diccionarios son mucho mas r√°pidos para conseguir un valor que una lista o como es que los generators recuerdan el estado de las variables al hacer yield, adem√°s hablo sobre las razones que los Core Developers tuvieron para tomar ciertas decisiones. Todo esto con ejemplos interesantes que levantar√°n m√°s de una ceja.\n\nConocer como funcionan los int√©rpretes de Python nos puede ayudar a escribir mejor c√≥digo, CPython es el mas com√∫n de los int√©rpretes de python y es por esta raz√≥n que durante la charla me enfoco en este, explico las decisiones de dise√±o mostrando parte del c√≥digo del int√©rprete y finalizo explicando como se pueden realizar contribuciones y como comenzar üöÄ\n\n\nWe want to say thanks to all our sponsors who helped make the conference a huge success.\n\n\n Universidad EAFIT \n http://www.eafit.edu.co/\n\n Globant \n https://www.globant.com/\n\n Linode \n https://www.linode.com/\n\n Mercadolibre.com \n https://www.mercadolibre.com.co/\n\n monoku.com \n https://monoku.com/\n\n Playvox \n https://www.playvox.com/\n\n UruIT \n https://uruit.com/\n\n Elastic \n https://www.elastic.co/es/\n\n #The_Python_Software_Foundation \n https://www.python.org/\n\n Monadical \n https://monadical.com/\n\n Fluid Attacks \n https://fluidattacks.com/\n\n Swapps \n https://swapps.com/\n\n TributiOnline \n https://www.tributi.com/\n\n VanHack \n https://vanhack.com/\n\n Avanet \n http://avanet.org/\n\n Cafeto Software \n https://cafeto.co/\n\n OmniBnk \n https://omnibnk.com/\n\n AutonomicMind \n https://autonomicmind.com/\n\n #AIFund \n https://aifund.ai/  \n\nFollow us\n\nFacebook: https://www.facebook.com/pyconcolombia\nTwitter: https://twitter.com/pyconcolombia\nInstagram:  https://www.instagram.com/pyconcolombia/\nTelegram: https://t.me/pyconcolombia\nLinkedIn: https://www.linkedin.com/company/pycon\ncolombia/\nFlickr: https://www.flickr.com/photos/pyconcolombia/\n\nMore About PyCon Colombia in http://www.pycon.co",
  "duration": 1466,
  "language": "spa",
  "recorded": "2020\n02\n07",
  "related_urls": [
    {
      "label": "Conference Website",
      "url": "https://2020.pycon.co/"
    },
    {
      "label": "https://cafeto.co/",
      "url": "https://cafeto.co/"
    },
    {
      "label": "https://www.mercadolibre.com.co/",
      "url": "https://www.mercadolibre.com.co/"
    },
    {
      "label": "https://www.linkedin.com/company/pycon\ncolombia/",
      "url": "https://www.linkedin.com/company/pycon\ncolombia/"
    },
    {
      "label": "http://www.eafit.edu.co/",
      "url": "http://www.eafit.edu.co/"
    },
    {
      "label": "https://vanhack.com/",
      "url": "https://vanhack.com/"
    },
    {
      "label": "https://twitter.com/keeevinh",
      "url": "https://twitter.com/keeevinh"
    },
    {
      "label": "https://swapps.com/",
      "url": "https://swapps.com/"
    },
    {
      "label": "https://www.globant.com/",
      "url": "https://www.globant.com/"
    },
    {
      "label": "https://aifund.ai/",
      "url": "https://aifund.ai/"
    },
    {
      "label": "https://www.facebook.com/pyconcolombia",
      "url": "https://www.facebook.com/pyconcolombia"
    },
    {
      "label": "https://www.elastic.co/es/",
      "url": "https://www.elastic.co/es/"
    },
    {
      "label": "https://t.me/pyconcolombia",
      "url": "https://t.me/pyconcolombia"
    },
    {
      "label": "https://omnibnk.com/",
      "url": "https://omnibnk.com/"
    },
    {
      "label": "https://www.python.org/",
      "url": "https://www.python.org/"
    },
    {
      "label": "https://monadical.com/",
      "url": "https://monadical.com/"
    },
    {
      "label": "https://www.flickr.com/photos/pyconcolombia/",
      "url": "https://www.flickr.com/photos/pyconcolombia/"
    },
    {
      "label": "https://www.linkedin.com/in/keeeevin/",
      "url": "https://www.linkedin.com/in/keeeevin/"
    },
    {
      "label": "https://www.playvox.com/",
      "url": "https://www.playvox.com/"
    },
    {
      "label": "http://avanet.org/",
      "url": "http://avanet.org/"
    },
    {
      "label": "https://monoku.com/",
      "url": "https://monoku.com/"
    },
    {
      "label": "https://fluidattacks.com/",
      "url": "https://fluidattacks.com/"
    },
    {
      "label": "https://www.linode.com/",
      "url": "https://www.linode.com/"
    },
    {
      "label": "http://www.pycon.co",
      "url": "http://www.pycon.co"
    },
    {
      "label": "https://twitter.com/pyconcolombia",
      "url": "https://twitter.com/pyconcolombia"
    },
    {
      "label": "https://uruit.com/",
      "url": "https://uruit.com/"
    },
    {
      "label": "https://github.com/kevteg",
      "url": "https://github.com/kevteg"
    },
    {
      "label": "https://www.instagram.com/pyconcolombia/",
      "url": "https://www.instagram.com/pyconcolombia/"
    },
    {
      "label": "https://www.tributi.com/",
      "url": "https://www.tributi.com/"
    },
    {
      "label": "https://autonomicmind.com/",
      "url": "https://autonomicmind.com/"
    }
  ],
  "speakers": [
    "Kevin Hern√°ndez"
  ],
  "tags": [],
  "thumbnail_url": "https://i.ytimg.com/vi_webp/_SQR9Z15FH0/maxresdefault.webp",
  "title": "Y is X but X is Not Always Y: An Introduction to Python Internals",
  "videos": [
    {
      "type": "youtube",
      "url": "https://www.youtube.com/watch?v=_SQR9Z15FH0"
    }
  ]
}
