{
  "description": "*Charla: El arte de extender Python con otros lenguajes*\n\nKeynote PyCon Chile 2023, Domingo 26 Noviembre 2023.\n\nCristi\u00e1n trabaja como Sr. R&D Manager en The Qt Company. En su d\u00eda a d\u00eda trabaja con C++, Python y CPython, que suelen ser los temas de sus charlas. En su tiempo libre le gusta colaborar con comunidades Open Source, principalmente Python, como Python en Espa\u00f1ol https://hablemospython.dev, Python Chile https://pythonchile.cl, Python Espa\u00f1a https://es.python.org, PyLadies Berlin https://berlin.pyladies.com y conferencias como PyConUS, PyLadiesCon, Europython, \u00a1y muchas m\u00e1s!\n\nEn esta interesant\u00edsima charla, Cristi\u00e1n muestra como distintos lenguaje de programaci\u00f3n ofrecen la posibilidad de extender Python, y casos actuales a los cuales se les puede atribuir su popularidad.  Se presentan ejemplos pr\u00e1cticos de extensiones en C++, Rust, mencionando otros casos con Lua, Zig, entre otros.\n\n----\n\nPyCon Chile 2023 - https://pycon.cl/\n\nPyCon Chile es un evento gratuito organizado por la comunidad Python Chile, para promover la divulgaci\u00f3n y ense\u00f1anza de Python. Esta conferencia busca reunir a todos los entusiastas de Python, desde principiantes hasta usuarios avanzados, para compartir distintas tem\u00e1ticas relacionadas al lenguaje.\n\nSi te interesa utilizar Python en \u00e1reas tan variadas como ciencia de datos, inteligencia artificial, astronom\u00eda, geolog\u00eda, optimizaci\u00f3n matem\u00e1tica o ciencias sociales, entre otras, \u00a1este evento te encantar\u00e1!\n\n----\n\n\u2605 \u00a1\u00danete a la comunidad PythonChile! \u2605\n\n\u2022 Twitter: https://twitter.com/pythonchiledev\n\u2022 Facebook: https://www.facebook.com/groups/pytho...\n\u2022 Telegram: https://t.me/pythonchile\n\u2022 Discord: https://discord.gg/dTHMfJvauS",
  "duration": 3586,
  "language": "spa",
  "recorded": "2022-11-24",
  "related_urls": [
    {
      "label": "Conference Website",
      "url": "https://pycon.cl/2023/"
    },
    {
      "label": "https://pythonchile.cl,",
      "url": "https://pythonchile.cl,"
    },
    {
      "label": "https://hablemospython.dev,",
      "url": "https://hablemospython.dev,"
    },
    {
      "label": "https://twitter.com/pythonchiledev",
      "url": "https://twitter.com/pythonchiledev"
    },
    {
      "label": "https://www.facebook.com/groups/pytho...",
      "url": "https://www.facebook.com/groups/pytho..."
    },
    {
      "label": "https://berlin.pyladies.com",
      "url": "https://berlin.pyladies.com"
    },
    {
      "label": "https://es.python.org,",
      "url": "https://es.python.org,"
    },
    {
      "label": "https://pycon.cl/",
      "url": "https://pycon.cl/"
    },
    {
      "label": "https://t.me/pythonchile",
      "url": "https://t.me/pythonchile"
    },
    {
      "label": "https://discord.gg/dTHMfJvauS",
      "url": "https://discord.gg/dTHMfJvauS"
    }
  ],
  "speakers": [
    "TODO"
  ],
  "tags": [
    "C leng",
    "Keynote",
    "Lenguajes de programaci\u00f3n",
    "Lua",
    "Pycon2023",
    "Python",
    "Rust",
    "Zig",
    "c++",
    "lenguajes"
  ],
  "thumbnail_url": "https://i.ytimg.com/vi/kUKdJwER8FM/maxresdefault.jpg",
  "title": "PyCon Chile 2023 Cristi\u00e1n Maureira Fredes - Keynote: El arte de extender Python con otros lenguajes",
  "videos": [
    {
      "type": "youtube",
      "url": "https://www.youtube.com/watch?v=kUKdJwER8FM"
    }
  ]
}
